{
  "updated": "2026-09-12",
  "editable": false,
  "id": "igz.section1.header-list",
  "type": "u32 count, flagged u32 pointer, u32[count] section-relative offsets (0xFFFFFFFF = null, 35 in the tutorial)",
  "evidence": [
    {
      "experiment_id": "m3-level_027_tutorial-e3-1789250807367",
      "summary": "Clone + null-slot list entry: level loads (15 341 kB served), scene identical to control in 2/2 runs"
    },
    {
      "probe": "ssa-archive scratch table-census.mjs (2026-09-13)",
      "summary": "CONTRADICTION: the offsets array is BEFORE the flagged word (which is its end), so the 35 \"null slots\" were 0xFFFFFFFF words inside objects and the M3 list write landed inside an object; superseded by igz.section1.header-table"
    }
  ],
  "category": "references",
  "meaning": "Superseded by igz.section1.header-table: the array of section-relative offsets lies between the 8 header words and the flagged end word; there are no null slots. The first M3 clone was therefore never listed anywhere, which, with igz.loader.pointer-traversal, explains why it stayed inert.",
  "structure": "Section-1 header list (count 0xB32) and its null slots",
  "endian": "be",
  "location": {
    "offset": "section 1 + 0x0C/0x10 (count), + (word 0x14 & 0x7FFFFFFF) offsets array",
    "file_pattern": "level/*.bld:level.bld (decoded)",
    "length": 4
  },
  "confidence": "UNKNOWN"
}