{
  "id": "level.entities.script-spawned",
  "updated": "2026-09-13",
  "editable": false,
  "category": "gameplay-logic",
  "confidence": "LIKELY",
  "endian": "be",
  "type": "where visible dynamic entities come from in level.bld",
  "structure": "Visible dynamic entities are spawned by script bytecode, not placed as records",
  "location": {
    "offset": "type-92 script records (157) and section 5 (second object section, 4 584 class pointers); OpCodeList x45 are small macro opcode lists (0x3C–0x18C)",
    "file_pattern": "level/*.bld:level.bld (decoded)",
    "length": 1
  },
  "meaning": "Section 1 holds no per-prop transform table (matrix search: 913 false positives owned by igVertexFormat/ScriptSetReference/igIntKey, none near the spawn except two round-valued igIntKey script values), the type-42 object at 0x115B50 (count 0x5DA) is a bounding-volume tree (its first pair is the whole-level AABB; its -259.26 was the first, effect-less M2 pipeline test), and the type-52 nodes name assets (.lvl) rather than instances. Static props are therefore baked into the level mesh, and dynamic actors (chompies, barrels, Hugo) are created by scripts: the engine exposes a \"clone||at|facing||cloned\" opcode, and script arguments carry world positions (Hugo waypoints). Consequence for a VISIBLE duplication: duplicate a spawn instruction (or move its position argument first, M2-style), which requires decoding the script bytecode format (type-92 blob bodies / section 5) — a static chantier before any boot.",
  "evidence": [
    {
      "probe": "scratch visible.mjs / opmacro.mjs / ops.mjs / opcodelist.mjs",
      "summary": "no transform table in section 1; type-42 0x115B50 = AABB tree; type-52 = 176 asset names x 11; Op* headers: OpUseMacro 50, OpStartUp 50, OpCodeList 45 (small), OpSpawn only as a false header"
    },
    {
      "probe": "igz near 91 10 44 --tol 30",
      "summary": "triples near the spawn are trigger boxes (ScriptSetReference), ScriptSet positions, script arguments (OpUseMacro) and the tfbPhysicsModel spawn"
    }
  ]
}