{
    "updated":  "2026-09-12",
    "editable":  false,
    "id":  "level.bld.nested-igz",
    "type":  "IGZ file",
    "evidence":  [
                     {
                         "probe":  "research-probes/probe-chunks.mjs",
                         "summary":  "7/7 entries of 3 archives start with IGZ magic"
                     }
                 ],
    "category":  "igz-objects",
    "meaning":  "Every decoded entry starts with 49 47 5A 01 00 00 00 05 (\"IGZ\\x01\", 5); the nested level.bld (1.3 to 31 MB) is presumed to hold world data",
    "structure":  "Nested level.bld and language .pak entries",
    "endian":  "be",
    "location":  {
                     "offset":  0,
                     "file_pattern":  "level/*.bld",
                     "length":  8
                 },
    "confidence":  "LIKELY"
}
