{
  "id": "level.drifting-piece.waypoint-translation",
  "updated": "2026-09-15",
  "category": "world-entities",
  "confidence": "CONFIRMED",
  "editable": true,
  "endian": "be",
  "type": "Tutorial type-104 Drifting_Piece placement +0xE4 -> type-147 waypoint list; count/capacity +8/+12, size word +16, array pointer +20; each type-148 waypoint stores f32be xyz at +0x20/+0x24/+0x28",
  "structure": "A drifting prop must translate its private waypoint positions with its placement position to move its visible animation",
  "location": {"file_pattern": "level/Level_027_Tutorial.bld:level.bld (decoded)", "offset": "placement 1919428; list 1919840; waypoint records 1919876,1919932,1919988", "length": 12},
  "meaning": "Changing only Drifting_Piece_ID1 +0x24 xyz reached the loaded archive and RAM but did not give the requested visible displacement (user observation). Drifting_Piece.ai uses Target Waypoint, Waypoint Index and Offset_Distance, then a displace instruction. Translating all three private waypoint xyz triples by the same delta as the placement made the island visibly move; the user confirmed the first run and the second byte-identical boot reproduced a displaced animated island. Editable scope: translation of existing private waypoint xyz for this tutorial Drifting_Piece layout, alongside the anchor. Refuse missing runtime pointer evidence, different record classes, invalid arrays and shared lists/points. No new records, pointer edits, script instruction/timing edits, geometry or collision edits; this is not an M4/M5 gate result. Other behaviours remain unsupported.",
  "evidence": [
    {"experiment_id": "editor-test-1789422682911-95bfe20d", "summary": "Anchor-only control: rebuilt archive consumed at 15333 kB versus original 15241 kB; edited xyz found in MEM1 at 0x80f90a08, but user reported no visible movement. Demonstrates that archive consumption is insufficient to validate a visual edit."},
    {"experiment_id": "editor-test-1789423192183-9c9f9406", "summary": "Research candidate: anchor delta (49.6019706726,14.8027755916,-21.7583732605) applied to three waypoint triples, 12 changed words total. Archive readback exact, FileMon 15333 kB, playable tutorial and movement captures; user: yes c'est move et visible. Owned Dolphin stopped normally."},
    {"experiment_id": "editor-test-1789423499358-5e86ea3c", "summary": "Second boot of the exact same rebuilt archive SHA256 8484bf6998fd24125b60b5f7dcf95bcdbbe83c700f2b66b3224005ed75da223d. FileMon consumed replacement, tutorial playable, displaced drifting island visible in captured frames; animation phase varies. Owned Dolphin stopped normally. Two runs, no crash observed."},
    {"probe": ".local/mesh-coverage-study/verify-trajectory-integration.mjs", "summary": "Editor translation produces byte-identical candidate decoded SHA256 1e688a0d5e09e8fa4a9d7d77894c4e1eb3d24d4273ece364bb9b207ba3d6b642. Save plan VALID with 12 fields and zero unclassified changed bytes; undo and redo byte-exact."}
  ]
}
